{
  "schema_version": "senior-pomidor.edge-core-compatibility-report.v1",
  "generated_at_utc": "2026-08-26T10:00:00Z",
  "status": "NOT_RUN",
  "core": {"git_sha": "c71d019f5d5511899b6134c7bc57ebf867d61755", "image_ref": "ghcr.io/cracketus/senior-pomidor-server@sha256:aaaaaaaaaaaaaaaaaaaaaaaaaaaaaaaaaaaaaaaaaaaaaaaaaaaaaaaaaaaaaaaa", "image_digest": "sha256:aaaaaaaaaaaaaaaaaaaaaaaaaaaaaaaaaaaaaaaaaaaaaaaaaaaaaaaaaaaaaaaa"},
  "edge": {"git_sha": "e1244ae0f9e4f08e5b272839c970e13f4fb7dcc9", "image_ref": "ghcr.io/cracketus/senior-pomidor-edge@sha256:bbbbbbbbbbbbbbbbbbbbbbbbbbbbbbbbbbbbbbbbbbbbbbbbbbbbbbbbbbbbbbbb", "image_digest": "sha256:bbbbbbbbbbbbbbbbbbbbbbbbbbbbbbbbbbbbbbbbbbbbbbbbbbbbbbbbbbbbbbbb"},
  "compatibility_window": {"old_edge_to_new_core": "telemetry-v1/v2 previous supported fixture", "new_edge_to_rollback_core": "v0.2.4"},
  "scenarios": [
    {"scenario_id": "normal-delivery", "applicability": "IMPLEMENTED", "evidence_scope": "SYNTHETIC", "started_at_utc": "2026-08-26T10:00:00Z", "finished_at_utc": "2026-08-26T10:00:00Z", "status": "NOT_RUN", "counts": {"generated": 0, "persisted": 0, "read_back": 0, "duplicates": 0, "missing": 0, "unknown": 0}, "alert_outcomes": [], "notes": ["Template fixture; real Edge evidence required."]},
    {"scenario_id": "core-outage-spool-growth", "applicability": "IMPLEMENTED", "evidence_scope": "SYNTHETIC", "started_at_utc": "2026-08-26T10:00:00Z", "finished_at_utc": "2026-08-26T10:00:00Z", "status": "NOT_RUN", "counts": {"generated": 0, "persisted": 0, "read_back": 0, "duplicates": 0, "missing": 0, "unknown": 0}, "alert_outcomes": [], "notes": ["Template fixture; real Edge evidence required."]},
    {"scenario_id": "core-recovery-full-drain", "applicability": "IMPLEMENTED", "evidence_scope": "SYNTHETIC", "started_at_utc": "2026-08-26T10:00:00Z", "finished_at_utc": "2026-08-26T10:00:00Z", "status": "NOT_RUN", "counts": {"generated": 0, "persisted": 0, "read_back": 0, "duplicates": 0, "missing": 0, "unknown": 0}, "alert_outcomes": [], "notes": ["Template fixture; real Edge evidence required."]},
    {"scenario_id": "lost-ack-after-persistence", "applicability": "IMPLEMENTED", "evidence_scope": "SYNTHETIC", "started_at_utc": "2026-08-26T10:00:00Z", "finished_at_utc": "2026-08-26T10:00:00Z", "status": "NOT_RUN", "counts": {"generated": 0, "persisted": 0, "read_back": 0, "duplicates": 0, "missing": 0, "unknown": 0}, "alert_outcomes": [], "notes": ["Template fixture; real Edge evidence required."]},
    {"scenario_id": "duplicate-http-mqtt", "applicability": "IMPLEMENTED", "evidence_scope": "SYNTHETIC", "started_at_utc": "2026-08-26T10:00:00Z", "finished_at_utc": "2026-08-26T10:00:00Z", "status": "NOT_RUN", "counts": {"generated": 0, "persisted": 0, "read_back": 0, "duplicates": 0, "missing": 0, "unknown": 0}, "alert_outcomes": [], "notes": ["Template fixture; real Edge evidence required."]},
    {"scenario_id": "edge-restart-pending", "applicability": "IMPLEMENTED", "evidence_scope": "SYNTHETIC", "started_at_utc": "2026-08-26T10:00:00Z", "finished_at_utc": "2026-08-26T10:00:00Z", "status": "NOT_RUN", "counts": {"generated": 0, "persisted": 0, "read_back": 0, "duplicates": 0, "missing": 0, "unknown": 0}, "alert_outcomes": [], "notes": ["Template fixture; real Edge evidence required."]},
    {"scenario_id": "fresh-during-backlog-replay", "applicability": "IMPLEMENTED", "evidence_scope": "SYNTHETIC", "started_at_utc": "2026-08-26T10:00:00Z", "finished_at_utc": "2026-08-26T10:00:00Z", "status": "NOT_RUN", "counts": {"generated": 0, "persisted": 0, "read_back": 0, "duplicates": 0, "missing": 0, "unknown": 0}, "alert_outcomes": [], "notes": ["Template fixture; real Edge evidence required."]},
    {"scenario_id": "watchdog-recovering-suppressed", "applicability": "IMPLEMENTED", "evidence_scope": "SYNTHETIC", "started_at_utc": "2026-08-26T10:00:00Z", "finished_at_utc": "2026-08-26T10:00:00Z", "status": "NOT_RUN", "counts": {"generated": 0, "persisted": 0, "read_back": 0, "duplicates": 0, "missing": 0, "unknown": 0}, "alert_outcomes": [], "notes": ["Template fixture; real Edge evidence required."]},
    {"scenario_id": "spool-degraded-critical", "applicability": "IMPLEMENTED", "evidence_scope": "SYNTHETIC", "started_at_utc": "2026-08-26T10:00:00Z", "finished_at_utc": "2026-08-26T10:00:00Z", "status": "NOT_RUN", "counts": {"generated": 0, "persisted": 0, "read_back": 0, "duplicates": 0, "missing": 0, "unknown": 0}, "alert_outcomes": [], "notes": ["Template fixture; real Edge evidence required."]},
    {"scenario_id": "delayed-stale-future-out-of-order", "applicability": "IMPLEMENTED", "evidence_scope": "SYNTHETIC", "started_at_utc": "2026-08-26T10:00:00Z", "finished_at_utc": "2026-08-26T10:00:00Z", "status": "NOT_RUN", "counts": {"generated": 0, "persisted": 0, "read_back": 0, "duplicates": 0, "missing": 0, "unknown": 0}, "alert_outcomes": [], "notes": ["Template fixture; real Edge evidence required."]}
  ]
}
